[
  {
    "assay_id": "EXP-AGGR-2026-46345",
    "timestamp": 1772544000,
    "protein": {
      "uniprot_id": "P05067",
      "name": "Amyloid-beta A4 protein (1-42)",
      "sequence": "MLPGLALLLLAAWTARALEVPTDGNAGLLAEPQIAMFCGRLN"
    },
    "drug": {
      "chembl_id": "CHEMBL1089750",
      "canonical_smiles": "CC1(C)[C@H]2CC[C@](C)(C2)[C@H]1NS(=O)(=O)c1ccc(F)cc1",
      "molecular_weight": 311.42
    },
    "conditions": {
      "temperature_celsius": 37.0,
      "ph": 7.4,
      "drug_concentration_umol": 20.0
    },
    "label": {
      "inhibition_percentage": 19.0,
      "outcome": "INACTIVE"
    }
  },
  {
    "assay_id": "EXP-AGGR-2026-57576",
    "timestamp": 1772544000,
    "protein": {
      "uniprot_id": "P05067",
      "name": "Amyloid-beta A4 protein (1-42)",
      "sequence": "MLPGLALLLLAAWTARALEVPTDGNAGLLAEPQIAMFCGRLN"
    },
    "drug": {
      "chembl_id": "CHEMBL311039",
      "canonical_smiles": "CC12CCC(C1)C(C)(C)C2NS(=O)(=O)c1ccc(F)cc1",
      "molecular_weight": 311.42
    },
    "conditions": {
      "temperature_celsius": 37.0,
      "ph": 7.4,
      "drug_concentration_umol": 20.0
    },
    "label": {
      "inhibition_percentage": 31.0,
      "outcome": "INACTIVE"
    }
  },
  {
    "assay_id": "EXP-AGGR-2026-57579",
    "timestamp": 1772544000,
    "protein": {
      "uniprot_id": "P05067",
      "name": "Amyloid-beta A4 protein (1-42)",
      "sequence": "MLPGLALLLLAAWTARALEVPTDGNAGLLAEPQIAMFCGRLN"
    },
    "drug": {
      "chembl_id": "CHEMBL450926",
      "canonical_smiles": "CC12CC[C@@H](C1)C(C)(C)[C@@H]2NS(=O)(=O)c1cccs1",
      "molecular_weight": 299.46
    },
    "conditions": {
      "temperature_celsius": 37.0,
      "ph": 7.4,
      "drug_concentration_umol": 20.0
    },
    "label": {
      "inhibition_percentage": 47.0,
      "outcome": "INACTIVE"
    }
  },
  {
    "assay_id": "EXP-AGGR-2026-58964",
    "timestamp": 1772544000,
    "protein": {
      "uniprot_id": "P05067",
      "name": "Amyloid-beta A4 protein (1-42)",
      "sequence": "MLPGLALLLLAAWTARALEVPTDGNAGLLAEPQIAMFCGRLN"
    },
    "drug": {
      "chembl_id": "CHEMBL310242",
      "canonical_smiles": "CC12CC[C@@H](C1)C(C)(C)[C@@H]2NS(=O)(=O)c1ccc(F)cc1",
      "molecular_weight": 311.42
    },
    "conditions": {
      "temperature_celsius": 37.0,
      "ph": 7.4,
      "drug_concentration_umol": 20.0
    },
    "label": {
      "inhibition_percentage": 58.0,
      "outcome": "INHIBITOR"
    }
  },
  {
    "assay_id": "EXP-AGGR-2026-68886",
    "timestamp": 1772544000,
    "protein": {
      "uniprot_id": "P05067",
      "name": "Amyloid-beta A4 protein (1-42)",
      "sequence": "MLPGLALLLLAAWTARALEVPTDGNAGLLAEPQIAMFCGRLN"
    },
    "drug": {
      "chembl_id": "CHEMBL74874",
      "canonical_smiles": "CC12CC[C@@H](C1)C(C)(C)[C@@H]2NS(=O)(=O)c1ccc(Cl)cc1",
      "molecular_weight": 327.88
    },
    "conditions": {
      "temperature_celsius": 37.0,
      "ph": 7.4,
      "drug_concentration_umol": 20.0
    },
    "label": {
      "inhibition_percentage": 26.0,
      "outcome": "INACTIVE"
    }
  },
  {
    "assay_id": "EXP-AGGR-2026-75953",
    "timestamp": 1772544000,
    "protein": {
      "uniprot_id": "P05067",
      "name": "Amyloid-beta A4 protein (1-42)",
      "sequence": "MLPGLALLLLAAWTARALEVPTDGNAGLLAEPQIAMFCGRLN"
    },
    "drug": {
      "chembl_id": "CHEMBL75183",
      "canonical_smiles": "CC12CC[C@@H](C1)C(C)(C)[C@@H]2NS(=O)(=O)c1ccc(Br)cc1",
      "molecular_weight": 372.33
    },
    "conditions": {
      "temperature_celsius": 37.0,
      "ph": 7.4,
      "drug_concentration_umol": 20.0
    },
    "label": {
      "inhibition_percentage": 24.0,
      "outcome": "INACTIVE"
    }
  },
  {
    "assay_id": "EXP-AGGR-2026-88981",
    "timestamp": 1772544000,
    "protein": {
      "uniprot_id": "P05067",
      "name": "Amyloid-beta A4 protein (1-42)",
      "sequence": "MLPGLALLLLAAWTARALEVPTDGNAGLLAEPQIAMFCGRLN"
    },
    "drug": {
      "chembl_id": "CHEMBL432343",
      "canonical_smiles": "CC12CC[C@@H](C1)C(C)(C)[C@H]2NS(=O)(=O)c1ccc(F)cc1",
      "molecular_weight": 311.42
    },
    "conditions": {
      "temperature_celsius": 37.0,
      "ph": 7.4,
      "drug_concentration_umol": 20.0
    },
    "label": {
      "inhibition_percentage": 0.0,
      "outcome": "INACTIVE"
    }
  },
  {
    "assay_id": "EXP-AGGR-2026-90318",
    "timestamp": 1772544000,
    "protein": {
      "uniprot_id": "P05067",
      "name": "Amyloid-beta A4 protein (1-42)",
      "sequence": "MLPGLALLLLAAWTARALEVPTDGNAGLLAEPQIAMFCGRLN"
    },
    "drug": {
      "chembl_id": "CHEMBL2114129",
      "canonical_smiles": "CC1(C)[C@@H]2CC[C@@](C)(C2)[C@H]1NS(=O)(=O)c1ccc(F)cc1",
      "molecular_weight": 311.42
    },
    "conditions": {
      "temperature_celsius": 37.0,
      "ph": 7.4,
      "drug_concentration_umol": 20.0
    },
    "label": {
      "inhibition_percentage": 0.0,
      "outcome": "INACTIVE"
    }
  },
  {
    "assay_id": "EXP-AGGR-2026-31485",
    "timestamp": 1772544000,
    "protein": {
      "uniprot_id": "P05067",
      "name": "Amyloid-beta A4 protein (1-42)",
      "sequence": "MLPGLALLLLAAWTARALEVPTDGNAGLLAEPQIAMFCGRLN"
    },
    "drug": {
      "chembl_id": "CHEMBL182896",
      "canonical_smiles": "CCOC(=O)N1CCC(c2ccccc2)(S(=O)(=O)c2ccccc2)CC1",
      "molecular_weight": 373.47
    },
    "conditions": {
      "temperature_celsius": 37.0,
      "ph": 7.4,
      "drug_concentration_umol": 20.0
    },
    "label": {
      "inhibition_percentage": 84.0,
      "outcome": "INHIBITOR"
    }
  },
  {
    "assay_id": "EXP-AGGR-2026-05957",
    "timestamp": 1772544000,
    "protein": {
      "uniprot_id": "P05067",
      "name": "Amyloid-beta A4 protein (1-42)",
      "sequence": "MLPGLALLLLAAWTARALEVPTDGNAGLLAEPQIAMFCGRLN"
    },
    "drug": {
      "chembl_id": "CHEMBL563",
      "canonical_smiles": "CC(C(=O)O)c1ccc(-c2ccccc2)c(F)c1",
      "molecular_weight": 244.26
    },
    "conditions": {
      "temperature_celsius": 37.0,
      "ph": 7.4,
      "drug_concentration_umol": 20.0
    },
    "label": {
      "inhibition_percentage": 30.0,
      "outcome": "INACTIVE"
    }
  },
  {
    "assay_id": "EXP-AGGR-2026-05975",
    "timestamp": 1772544000,
    "protein": {
      "uniprot_id": "P05067",
      "name": "Amyloid-beta A4 protein (1-42)",
      "sequence": "MLPGLALLLLAAWTARALEVPTDGNAGLLAEPQIAMFCGRLN"
    },
    "drug": {
      "chembl_id": "CHEMBL196279",
      "canonical_smiles": "CC(C(=O)O)c1ccc(-c2ccc(Cl)c(Cl)c2)c(F)c1",
      "molecular_weight": 313.15
    },
    "conditions": {
      "temperature_celsius": 37.0,
      "ph": 7.4,
      "drug_concentration_umol": 20.0
    },
    "label": {
      "inhibition_percentage": 87.0,
      "outcome": "INHIBITOR"
    }
  },
  {
    "assay_id": "EXP-AGGR-2026-05984",
    "timestamp": 1772544000,
    "protein": {
      "uniprot_id": "P05067",
      "name": "Amyloid-beta A4 protein (1-42)",
      "sequence": "MLPGLALLLLAAWTARALEVPTDGNAGLLAEPQIAMFCGRLN"
    },
    "drug": {
      "chembl_id": "CHEMBL195970",
      "canonical_smiles": "CC(C(=O)O)c1ccc(-c2cc(Cl)cc(Cl)c2)c(F)c1",
      "molecular_weight": 313.15
    },
    "conditions": {
      "temperature_celsius": 37.0,
      "ph": 7.4,
      "drug_concentration_umol": 20.0
    },
    "label": {
      "inhibition_percentage": 75.0,
      "outcome": "INHIBITOR"
    }
  },
  {
    "assay_id": "EXP-AGGR-2026-05992",
    "timestamp": 1772544000,
    "protein": {
      "uniprot_id": "P05067",
      "name": "Amyloid-beta A4 protein (1-42)",
      "sequence": "MLPGLALLLLAAWTARALEVPTDGNAGLLAEPQIAMFCGRLN"
    },
    "drug": {
      "chembl_id": "CHEMBL197456",
      "canonical_smiles": "CC(C(=O)O)c1ccc(-c2ccccc2Cl)c(F)c1",
      "molecular_weight": 278.71
    },
    "conditions": {
      "temperature_celsius": 37.0,
      "ph": 7.4,
      "drug_concentration_umol": 20.0
    },
    "label": {
      "inhibition_percentage": 13.0,
      "outcome": "INACTIVE"
    }
  },
  {
    "assay_id": "EXP-AGGR-2026-05994",
    "timestamp": 1772544000,
    "protein": {
      "uniprot_id": "P05067",
      "name": "Amyloid-beta A4 protein (1-42)",
      "sequence": "MLPGLALLLLAAWTARALEVPTDGNAGLLAEPQIAMFCGRLN"
    },
    "drug": {
      "chembl_id": "CHEMBL194098",
      "canonical_smiles": "CC(C(=O)O)c1ccc(-c2cccc(Cl)c2)c(F)c1",
      "molecular_weight": 278.71
    },
    "conditions": {
      "temperature_celsius": 37.0,
      "ph": 7.4,
      "drug_concentration_umol": 20.0
    },
    "label": {
      "inhibition_percentage": 58.0,
      "outcome": "INHIBITOR"
    }
  },
  {
    "assay_id": "EXP-AGGR-2026-05996",
    "timestamp": 1772544000,
    "protein": {
      "uniprot_id": "P05067",
      "name": "Amyloid-beta A4 protein (1-42)",
      "sequence": "MLPGLALLLLAAWTARALEVPTDGNAGLLAEPQIAMFCGRLN"
    },
    "drug": {
      "chembl_id": "CHEMBL193415",
      "canonical_smiles": "CC(C(=O)O)c1ccc(-c2ccc(Cl)cc2)c(F)c1",
      "molecular_weight": 278.71
    },
    "conditions": {
      "temperature_celsius": 37.0,
      "ph": 7.4,
      "drug_concentration_umol": 20.0
    },
    "label": {
      "inhibition_percentage": 55.0,
      "outcome": "INHIBITOR"
    }
  },
  {
    "assay_id": "EXP-AGGR-2026-05998",
    "timestamp": 1772544000,
    "protein": {
      "uniprot_id": "P05067",
      "name": "Amyloid-beta A4 protein (1-42)",
      "sequence": "MLPGLALLLLAAWTARALEVPTDGNAGLLAEPQIAMFCGRLN"
    },
    "drug": {
      "chembl_id": "CHEMBL264006",
      "canonical_smiles": "CC(C(=O)O)c1ccc(-c2ccc(C3CCCCC3)cc2)c(F)c1",
      "molecular_weight": 326.41
    },
    "conditions": {
      "temperature_celsius": 37.0,
      "ph": 7.4,
      "drug_concentration_umol": 20.0
    },
    "label": {
      "inhibition_percentage": 79.0,
      "outcome": "INHIBITOR"
    }
  },
  {
    "assay_id": "EXP-AGGR-2026-06009",
    "timestamp": 1772544000,
    "protein": {
      "uniprot_id": "P05067",
      "name": "Amyloid-beta A4 protein (1-42)",
      "sequence": "MLPGLALLLLAAWTARALEVPTDGNAGLLAEPQIAMFCGRLN"
    },
    "drug": {